{
  "schema_version": 1,
  "app_id": "replace-me",
  "reviewed_at": "YYYY-MM-DD",
  "reviewer": "",
  "overrides": {
    "GMS-GOV-001": {
      "status": "partial",
      "severity": "P1",
      "likelihood": 2,
      "impact": 3,
      "release_blocker": false,
      "finding": "What you observed, concretely.",
      "remediation": "The single next action that closes the gap.",
      "owner": "",
      "target_date": "",
      "ticket": "",
      "evidence_refs": [
        "path/to/code-or-config"
      ],
      "test_refs": [
        "path/to/test"
      ],
      "notes": ""
    }
  }
}
